{
  "$schema": "../../../schemas/bonvoyage-authoring-completion-v1.schema.json",
  "schema_version": 1,
  "classification": "routesphere-bonvoyage-configuration-completion-metadata",
  "completion_version": "bonvoyage.configuration-completion.v1",
  "contract_version": "bonvoyage.configuration-authoring.v1",
  "compiler_version": "bonvoyage-control-plane-phase4-admin-v1",
  "configuration_schema_version": 1,
  "authority": {
    "semantic_validation": "snapshot.Compile",
    "configuration_schema_role": "structural-assistance-only",
    "completion_scope": "direct-structural-and-literal-hints-only",
    "field_help": "reviewed-release-asset",
    "network_access": false,
    "live_mutation": false
  },
  "security_boundary": {
    "offline": true,
    "document_values_included": false,
    "secret_values_included": false,
    "environment_secret_reads": false
  },
  "sources": {
    "authoring_contract": {
      "path": "config/authoring/bonvoyage-authoring-v1.json",
      "sha256": "098b41f7a57ac3eadff59137b358df8aaf5e6bd5759639f2beaa5b81b39dcebf"
    },
    "configuration_schema": {
      "path": "config/schemas/bonvoyage-config.schema.json",
      "sha256": "692bdf2e832d009906bc026f524df474ebde15999e09e0c75b31da2cd43365b0"
    },
    "field_explanations": {
      "path": "control-plane/internal/configauthoring/catalog/bonvoyage-field-explanations-v1.json",
      "sha256": "fb9efa08d09532dce993b26cee829066081c7db2db5b2980954904e52138bef5"
    }
  },
  "entry_count": 160,
  "entries": [
    {
      "path": "",
      "parent_path": null,
      "key": null,
      "title": "BonVoyage configuration",
      "summary": "The complete declarative desired state compiled into one immutable BonVoyage snapshot.",
      "required_in_parent": true,
      "secret_reference": false,
      "value": {
        "kind": "object"
      }
    },
    {
      "path": "/clusters",
      "parent_path": "",
      "key": "clusters",
      "title": "Clusters",
      "summary": "The non-empty set of named upstream service pools available to routes.",
      "required_in_parent": true,
      "secret_reference": false,
      "value": {
        "kind": "array",
        "min_items": 1,
        "item": {
          "kind": "object"
        }
      }
    },
    {
      "path": "/clusters/*/active_health",
      "parent_path": "/clusters/*",
      "key": "active_health",
      "title": "Active health checks",
      "summary": "Optional periodic HTTP health probing for endpoints in this cluster.",
      "required_in_parent": false,
      "secret_reference": false,
      "value": {
        "kind": "object"
      }
    },
    {
      "path": "/clusters/*/active_health/expected_status_max",
      "parent_path": "/clusters/*/active_health",
      "key": "expected_status_max",
      "title": "Maximum healthy status",
      "summary": "The inclusive highest HTTP response status considered healthy by an active probe.",
      "required_in_parent": false,
      "secret_reference": false,
      "value": {
        "kind": "integer",
        "minimum": 200,
        "maximum": 599
      }
    },
    {
      "path": "/clusters/*/active_health/expected_status_min",
      "parent_path": "/clusters/*/active_health",
      "key": "expected_status_min",
      "title": "Minimum healthy status",
      "summary": "The inclusive lowest HTTP response status considered healthy by an active probe.",
      "required_in_parent": false,
      "secret_reference": false,
      "value": {
        "kind": "integer",
        "minimum": 200,
        "maximum": 599
      }
    },
    {
      "path": "/clusters/*/active_health/healthy_threshold",
      "parent_path": "/clusters/*/active_health",
      "key": "healthy_threshold",
      "title": "Healthy threshold",
      "summary": "The consecutive successful probes required before an endpoint becomes healthy.",
      "required_in_parent": false,
      "secret_reference": false,
      "value": {
        "kind": "integer",
        "minimum": 1,
        "maximum": 100
      }
    },
    {
      "path": "/clusters/*/active_health/host",
      "parent_path": "/clusters/*/active_health",
      "key": "host",
      "title": "Health-check host",
      "summary": "The HTTP Host or authority value used by active health-check requests.",
      "required_in_parent": false,
      "secret_reference": false,
      "value": {
        "kind": "string",
        "min_length": 1,
        "max_length": 253
      }
    },
    {
      "path": "/clusters/*/active_health/interval_ms",
      "parent_path": "/clusters/*/active_health",
      "key": "interval_ms",
      "title": "Health-check interval",
      "summary": "The delay in milliseconds between scheduled active health probes.",
      "required_in_parent": false,
      "secret_reference": false,
      "value": {
        "kind": "integer",
        "minimum": 1000,
        "maximum": 300000
      }
    },
    {
      "path": "/clusters/*/active_health/path",
      "parent_path": "/clusters/*/active_health",
      "key": "path",
      "title": "Health-check path",
      "summary": "The absolute HTTP request path used for active health probes.",
      "required_in_parent": false,
      "secret_reference": false,
      "value": {
        "kind": "string",
        "min_length": 1,
        "max_length": 4096,
        "pattern": "^/[^#\\u0000-\\u0020\\u007F]*$"
      }
    },
    {
      "path": "/clusters/*/active_health/timeout_ms",
      "parent_path": "/clusters/*/active_health",
      "key": "timeout_ms",
      "title": "Health-check timeout",
      "summary": "The maximum time in milliseconds allowed for one active health probe.",
      "required_in_parent": false,
      "secret_reference": false,
      "value": {
        "kind": "integer",
        "minimum": 100,
        "maximum": 10000
      }
    },
    {
      "path": "/clusters/*/active_health/unhealthy_threshold",
      "parent_path": "/clusters/*/active_health",
      "key": "unhealthy_threshold",
      "title": "Unhealthy threshold",
      "summary": "The consecutive failed probes required before an endpoint becomes unhealthy.",
      "required_in_parent": false,
      "secret_reference": false,
      "value": {
        "kind": "integer",
        "minimum": 1,
        "maximum": 100
      }
    },
    {
      "path": "/clusters/*/connect_timeout_ms",
      "parent_path": "/clusters/*",
      "key": "connect_timeout_ms",
      "title": "Connect timeout",
      "summary": "The maximum time in milliseconds allowed to establish an upstream connection.",
      "required_in_parent": false,
      "secret_reference": false,
      "value": {
        "kind": "integer",
        "minimum": 1,
        "maximum": 60000
      }
    },
    {
      "path": "/clusters/*/dns_refresh",
      "parent_path": "/clusters/*",
      "key": "dns_refresh",
      "title": "DNS refresh",
      "summary": "Optional bounded asynchronous hostname-resolution policy for cluster endpoints.",
      "required_in_parent": false,
      "secret_reference": false,
      "value": {
        "kind": "object"
      }
    },
    {
      "path": "/clusters/*/dns_refresh/refresh_interval_ms",
      "parent_path": "/clusters/*/dns_refresh",
      "key": "refresh_interval_ms",
      "title": "DNS refresh interval",
      "summary": "The interval in milliseconds between accepted endpoint hostname refreshes.",
      "required_in_parent": false,
      "secret_reference": false,
      "value": {
        "kind": "integer",
        "minimum": 1000,
        "maximum": 3600000
      }
    },
    {
      "path": "/clusters/*/dns_refresh/resolve_timeout_ms",
      "parent_path": "/clusters/*/dns_refresh",
      "key": "resolve_timeout_ms",
      "title": "DNS resolution timeout",
      "summary": "The maximum time in milliseconds allowed for one endpoint hostname resolution.",
      "required_in_parent": false,
      "secret_reference": false,
      "value": {
        "kind": "integer",
        "minimum": 100,
        "maximum": 10000
      }
    },
    {
      "path": "/clusters/*/endpoints",
      "parent_path": "/clusters/*",
      "key": "endpoints",
      "title": "Endpoints",
      "summary": "The non-empty set of upstream network destinations owned by this cluster.",
      "required_in_parent": true,
      "secret_reference": false,
      "value": {
        "kind": "array",
        "min_items": 1,
        "max_items": 4096,
        "item": {
          "kind": "object"
        }
      }
    },
    {
      "path": "/clusters/*/endpoints/*/address",
      "parent_path": "/clusters/*/endpoints/*",
      "key": "address",
      "title": "Endpoint address",
      "summary": "The IP address or hostname used to connect to this upstream endpoint.",
      "required_in_parent": true,
      "secret_reference": false,
      "value": {
        "kind": "string",
        "min_length": 1
      }
    },
    {
      "path": "/clusters/*/endpoints/*/name",
      "parent_path": "/clusters/*/endpoints/*",
      "key": "name",
      "title": "Endpoint name",
      "summary": "The unique stable name of this endpoint within its cluster.",
      "required_in_parent": true,
      "secret_reference": false,
      "value": {
        "kind": "string",
        "min_length": 1
      }
    },
    {
      "path": "/clusters/*/endpoints/*/port",
      "parent_path": "/clusters/*/endpoints/*",
      "key": "port",
      "title": "Endpoint port",
      "summary": "The TCP port used to connect to this upstream endpoint.",
      "required_in_parent": true,
      "secret_reference": false,
      "value": {
        "kind": "integer",
        "minimum": 1,
        "maximum": 65535
      }
    },
    {
      "path": "/clusters/*/endpoints/*/weight",
      "parent_path": "/clusters/*/endpoints/*",
      "key": "weight",
      "title": "Endpoint weight",
      "summary": "The relative endpoint selection weight used by a compatible load-balancing policy.",
      "required_in_parent": false,
      "secret_reference": false,
      "value": {